<deals xmlns:xs="http://www.w3.org/2001/XMLSchema-instance" 
xs:noNamespaceSchemaLocation="dealSchema.xsd">
	<deal>
		<id>1</id>
		<userId>1</userId>
		<discountId>1</discountId>
		<discountCode>VuiVeMuaSach</discountCode>
		<discountPrice>1.0</discountPrice>
		<totalPrice>50.0</totalPrice>
		<createDate>2021-06-13</createDate>
		<status>con hang</status>
	</deal>

	<deal>
		<id>2</id>
		<userId>1</userId>
		<discountId>2</discountId>
		<discountCode>KhuyenMai</discountCode>
		<discountPrice>1.0</discountPrice>
		<totalPrice>50.0</totalPrice>
		<createDate>2021-06-12</createDate>
		<status>con hang</status>
	</deal>
</deals>